id,title,completed
41,aliquid amet impedit consequatur aspernatur placeat eaque fugiat suscipit,False
42,rerum perferendis error quia ut eveniet,False
43,tempore ut sint quis recusandae,True
44,cum debitis quis accusamus doloremque ipsa natus sapiente omnis,True
45,velit soluta adipisci molestias reiciendis harum,False
46,vel voluptatem repellat nihil placeat corporis,False
47,nam qui rerum fugiat accusamus,False
48,sit reprehenderit omnis quia,False
49,ut necessitatibus aut maiores debitis officia blanditiis velit et,False
50,cupiditate necessitatibus ullam aut quis dolor voluptate,True
51,distinctio exercitationem ab doloribus,False
52,nesciunt dolorum quis recusandae ad pariatur ratione,False
53,qui labore est occaecati recusandae aliquid quam,False
54,quis et est ut voluptate quam dolor,True
55,voluptatum omnis minima qui occaecati provident nulla voluptatem ratione,True
56,deleniti ea temporibus enim,True
57,pariatur et magnam ea doloribus similique voluptatem rerum quia,False
58,est dicta totam qui explicabo doloribus qui dignissimos,False
59,perspiciatis velit id laborum placeat iusto et aliquam odio,False
60,et sequi qui architecto ut adipisci,True
